"schoolId","schoolName","schoolAddress","province","school_level","lat","long"
"20103314","SMAN 48 JAKARTA","JL. PINANG RANTI II TMII","Prop. D.K.I. Jakarta","SMA","-6.2877000","106.8831000"
"20108498","SMAS ADVENT 1 JAKARTA","JL. KRAMAT PULO NO. 16","Prop. D.K.I. Jakarta","SMA","-6.1792000","106.8438000"
"69889003","SMA NEW ZEALAND INDEPENDENT SCHOOL","JL. KEMANG RAYA NO 70","Prop. D.K.I. Jakarta","SMA","-6.2638910","106.8182670"
"20107368","SMAS AL KHAIRIYAH JAKARTA","JL. MINDI NO. 2","Prop. D.K.I. Jakarta","SMA","-6.1154000","106.9142000"
"20102219","SMAN 109 JAKARTA","JL. GARDU NO. 31","Prop. D.K.I. Jakarta","SMA","-6.3450000","106.8356000"
"20100197","SMAS TARSISIUS 1 JAKARTA","JL. KH. HASYIM ASHARI 26","Prop. D.K.I. Jakarta","SMA","-6.1645000","106.8152000"
"20100810","SMAN 40 JAKARTA","JL. BUDIMULYA RAYA","Prop. D.K.I. Jakarta","SMA","-6.1312000","106.8311000"
"20101611","SMAS SENTOSA","JL. MADU NO. 276","Prop. D.K.I. Jakarta","SMA","-6.1439000","106.8203000"
"20103296","SMAN 39 JAKARTA","JL. RA FADILAH CIJANTUNG","Prop. D.K.I. Jakarta","SMA","-6.3209000","106.8501000"
"20100604","SMA MAHATMA GADING","Jl. Boulevard BGR Komplek Villa Gading Indah Blok D","Prop. D.K.I. Jakarta","SMA","-6.1613000","106.8943000"
"69762654","SMAS DJUWITA","Perum. Puri Gardena, Jl. Gardena Utama raya","Prop. D.K.I. Jakarta","SMA","-6.1383570","106.7017200"
"69829193","SMA KRISTEN KASIH KEMULIAAN","JL. PERUM TAMAN SURYA V BLOK RR NO 1","Prop. D.K.I. Jakarta","SMA","-6.1614390","106.7077480"
"20100605","SMAS METHODIST JAKARTA","JL. BANDENGAN UTARA NO. 91A","Prop. D.K.I. Jakarta","SMA","-6.1364000","106.7865000"
"20101354","SMAS FAJRUL ISLAM","JL. TANJUNG PURA V","Prop. D.K.I. Jakarta","SMA","-6.1293000","106.6952000"
"20107312","SMAS KHARISMAWITA JAKARTA","JL. SWADAYA 02 NO. 30","Prop. D.K.I. Jakarta","SMA","-6.2997000","106.8460000"
"20104433","SMAS MUHAMMADIYAH 15","JL. ANGGREK NELI MURNI BC","Prop. D.K.I. Jakarta","SMA","-6.1870000","106.7954000"
"20103202","SMAS MUHAMMADIYAH 11 JAKARTA","JL. BALAI PUSTAKA  BARAT NO. 2","Prop. D.K.I. Jakarta","SMA","-6.1974000","106.8827000"
"20100780","SMAN 80 JAKARTA","JL. SUNTER KARYA SELATAN V","Prop. D.K.I. Jakarta","SMA","-6.1423000","106.8715000"
"20101620","SMAN 33 JAKARTA","JL. UTAMA I NO.2 CENGKARENG","Prop. D.K.I. Jakarta","SMA","-6.1493000","106.7274000"
"20107304","SMAS ISLAM AL-AZHAR 1 JAKARTA","JL. SISINGAMANGARAJA","Prop. D.K.I. Jakarta","SMA","-6.2341280","106.8002730"
"20107187","SMAS AL FALAH","Jl Raya Malaka No. 1D Munjul Cipayung","Prop. D.K.I. Jakarta","SMA","-6.3469000","106.8845000"
"20101343","SMAS DHAMASAVANA","JL. JEMBATAN II PADAMULYA VI / 176B","Prop. D.K.I. Jakarta","SMA","-6.1448000","106.7914000"
"20103292","SMAN 103 JAKARTA","JL. MAWAR MERAH VI PERUMNAS KLENDER","Prop. D.K.I. Jakarta","SMA","-6.2209000","106.9373000"
"20101618","SMAS VIANNEY","JL. Bojong Raya  No. 98","Prop. D.K.I. Jakarta","SMA","-6.1711000","106.7301000"
"","SMA CIKAL AMRI","Jl. Raya Setu No. 3","Prop. D.K.I. Jakarta","SMA","-6.3116541","106.9196799"
"20101610","SMAS  TARSISIUS II","JL. BATUSARI RAYA NO. 12","Prop. D.K.I. Jakarta","SMA","-6.1994000","106.7824000"
"20107308","SMAS KARTIKA X-1","JL. RAYA KODAM BINTARO NO. 53","Prop. D.K.I. Jakarta","SMA","-6.2604000","106.7587000"
"20107281","SMAS BAKTI MULYA 400","JL.LINGKAR SELATAN","Prop. D.K.I. Jakarta","SMA","-6.2835000","106.7735000"
"20101585","SMAN 94 JAKARTA","JL. RAYA SEMANAN","Prop. D.K.I. Jakarta","SMA","-6.1639000","106.6898000"
"20107338","SMAS YAPERJASA","Jl. Belimbing, RT. 08/07","Prop. D.K.I. Jakarta","SMA","-6.3327000","106.8236000"
"20103186","SMAS WIDYA MANGGALA JAKARTA","JL. MUJAHIDIN NO. 17","Prop. D.K.I. Jakarta","SMA","-6.3032000","106.8725000"
"69853555","SMA JAKARTA INTERNATIONAL SCHOOL","JALAN TEROGONG RAYA NO 33","Prop. D.K.I. Jakarta","SMA","-6.2865210","106.7884620"
"20104409","SMAS CAHAYA FADILAH","JL. LINGKAR LUAR BARAT NO.7 RT.013/007","Prop. D.K.I. Jakarta","SMA","-6.1753000","106.7187000"
"20112284","SMAS SEVILLA","JL. PULO MAS RAYA PULOMAS","Prop. D.K.I. Jakarta","SMA","-6.2090000","106.8565000"
"20108499","SMAS DWISAKA JAKARTA","JL. TAMBAK NO. 32 JAKARTA","Prop. D.K.I. Jakarta","SMA","-6.2048000","106.8492000"
"20110335","SMAS KRISTEN 6 PENABUR","JL.MUARA KARANG BLOK Z 3 S","Prop. D.K.I. Jakarta","SMA","-6.1153000","106.7745000"
"20109561","SMA SIS PIK","JL. Mandara Indah No.4","Prop. D.K.I. Jakarta","SMA","-6.1194240","106.7590550"
"20177837","SMAS SAINT JOHNS SCHOOL","Jl.Taman Villa Meruya Blok D1 No.1","Prop. D.K.I. Jakarta","SMA","-6.2067000","106.7371000"
"20101173","SMAS 1 BARUNAWATI","JL. X -III AIPDA KS TUBUN II - III NO. 7","Prop. D.K.I. Jakarta","SMA","-6.1949000","106.8012000"
"20107330","SMAS SERUNI DON BOSCO","JL. TB. SIMATUPANG","Prop. D.K.I. Jakarta","SMA","-6.2908000","106.7849000"
"20100196","SMAS TAMAN MADYA 5 JAKARTA","JL. PERCETAKAN NEGARA VIII NO. 16","Prop. D.K.I. Jakarta","SMA","-6.1921000","106.8620000"
"69921926","SMA ACG SCHOOL JAKARTA","Jl. Taman Margasatwa No. 19. Warung Jati Barat","Prop. D.K.I. Jakarta","SMA","-6.2850630","106.8301680"
"20103299","SMAN 89 JAKARTA","JL. KAYU TINGGI","Prop. D.K.I. Jakarta","SMA","-6.1752000","106.9515000"
"69931693","SMA KAIROS GRACIA","CITRA GARDEN 7 BLOK B1","Prop. D.K.I. Jakarta","SMA","-6.1536000","106.6888000"
"20100797","SMAN 52 JAKARTA","JL. RAYA TUGU SEMPER","Prop. D.K.I. Jakarta","SMA","-6.1223000","106.9239000"
"20107249","SMAS BUDI MULIA JAKARTA","JL. MANGGA BESAR RAYA 135","Prop. D.K.I. Jakarta","SMA","-6.1482000","106.8282000"
"20108507","SMAS SANTO BELLARMINUS JAKARTA","LOMBOK NO. 58 JAKARTA","Prop. D.K.I. Jakarta","SMA","-6.1886000","106.8252000"
"20103282","SMAN 22 JAKARTA","JL. Kramat Asem, Kec. Matraman, Jakarta Timur 13120","Prop. D.K.I. Jakarta","SMA","-6.2026000","106.8694000"
"20107372","SMAS CHANDRA KUSUMA JAKARTA","JL. PERUM VILAMAS SELATAN I BLOK H 4 NO. 1","Prop. D.K.I. Jakarta","SMA","-6.1392000","106.7707000"
"20100179","SMAS SANTO PAULUS JAKARTA","JL. SETIA KAWAN RAYA 39-41","Prop. D.K.I. Jakarta","SMA","-6.1643000","106.8015000"
"20101604","SMAN 57 JAKARTA","JL. RAYA KEDOYA","Prop. D.K.I. Jakarta","SMA","-6.1747000","106.7561000"
"20100613","SMAS TARAKANITA 2","JL. PLUIT PERMAI DALAM I / 10","Prop. D.K.I. Jakarta","SMA","-6.1143000","106.7915000"
"20100217","SMAN 10 JAKARTA","JL. MANGGA BESAR XIII","Prop. D.K.I. Jakarta","SMA","-6.1467000","106.8265000"
"20107383","SMAS KRISTEN IPEKA SUNTER","JL. BARU SUNTER AGUNG RT.15, RW.07, SUNTER AGUNG-JAKARTA UTARA 14350","Prop. D.K.I. Jakarta","SMA","-6.1542000","106.8710000"
"20112435","SMAS SINAR DHARMA","JL. KH. MOH. MANSYUR NO.29","Prop. D.K.I. Jakarta","SMA","-6.1493000","106.8075000"
"20100195","SMAS MUHAMMADIYAH 1 JAKARTA","JL. KRAMAT RAYA NO. 49","Prop. D.K.I. Jakarta","SMA","-6.1880000","106.8461000"
"20107378","SMAS HARAPAN KASIH JAKARTA","JL. MUARA BARU RAYA 5-7","Prop. D.K.I. Jakarta","SMA","-6.1299000","106.7973000"
"20101586","SMAN 85 JAKARTA","JL. SRENGSENG RAYA","Prop. D.K.I. Jakarta","SMA","-6.2154000","106.7591000"
"20108501","SMAS HATI SUCI","JL. HATI SUCI NO. 2","Prop. D.K.I. Jakarta","SMA","-6.1835000","106.8174000"
"20107371","SMAS CAHAYA KUDUS JAKARTA","JL.  MUARA KARANG B IX NO. 129","Prop. D.K.I. Jakarta","SMA","-6.1172000","106.7815000"
"20107373","SMAS DHARMA PUTRA JAKARTA","JL. SWASEMBADA BARAT XI NO.92","Prop. D.K.I. Jakarta","SMA","-6.1226000","106.8873000"
"20104426","SMAS 2 KRISTEN KALAM KUDUS","JL. KOSAMBI BARU BLOK F6/1","Prop. D.K.I. Jakarta","SMA","-6.1714000","106.7160000"
"20101324","SMAS NOTRE DAME","JL. PURI KEMBANG BARAT RAYA, BLOK M","Prop. D.K.I. Jakarta","SMA","-6.1881000","106.7425000"
"20102575","SMAN 55 JAKARTA","JL. MINYAK  RAYA DUREN TIGA","Prop. D.K.I. Jakarta","SMA","-6.2554000","106.8391000"
"","SMA JAC","Jl. Pegangsaan Dua Rt 003 Rw 003","Prop. D.K.I. Jakarta","SMA","-6.1596702","106.8930039"
"20107199","SMAS PRATAMA","JL.USMAN NO. 71","Prop. D.K.I. Jakarta","SMA","-6.3324000","106.8836000"
"20103166","SMAS PERGURUAN RAKYAT 2 JAKARTA","JL. AD. LAMPIRI RAYA","Prop. D.K.I. Jakarta","SMA","-6.2530000","106.9407000"
"20100631","SMAS KATOLIK DIAKONIA JAKARTA","JL. RAYA PLUIT UTARA RAYA NO. 2","Prop. D.K.I. Jakarta","SMA","-6.1121000","106.7894000"
"20100189","SMAS KRISTEN KANAAN JAKARTA","JL. KRAN RAYA NO. 7","Prop. D.K.I. Jakarta","SMA","-6.1597000","106.8463000"
"20107185","SMAN 69 JAKARTA","PULAU PRAMUKA RT 003/05","Prop. D.K.I. Jakarta","SMA","-5.7476320","106.6134864"
"20109062","SMAS MUTIARA BANGSA 3","Jelambar Barat III No. 5B","Prop. D.K.I. Jakarta","SMA","-6.1498000","106.7873000"
"20104425","SMAS KRISTEN IMANUEL","JL. ALAMANAH RAYA N0 145  A JELAMBAR","Prop. D.K.I. Jakarta","SMA","-6.1605000","106.7797000"
"20103256","SMAN 99 JAKARTA","JL.Cibubur  II","Prop. D.K.I. Jakarta","SMA","-6.3425000","106.8729000"
"20107291","SMAS DARUL MAARIF JAKARTA","JL. RS. FATMAWATI NO.45","Prop. D.K.I. Jakarta","SMA","-6.2674000","106.7980000"
"20100799","SMAS SANTO YAKOBUS JAKARTA","JL. PEGANGSAAN DUA KM. 3.5","Prop. D.K.I. Jakarta","SMA","-6.1535000","106.9158000"
"20107293","SMAS DELIMA","JL. BANGKA XI / 9B","Prop. D.K.I. Jakarta","SMA","-6.2515000","106.8260000"
"20103286","SMAN 113 JAKARTA","JL. ALBAIDHO I/MONUMEN LUBANG BUAYA JAKARTA TIMUR","Prop. D.K.I. Jakarta","SMA","-6.2929000","106.9030000"
"20102570","SMAN 70 JAKARTA","JL. BULUNGAN BLOK C / 1","Prop. D.K.I. Jakarta","SMA","-6.2417000","106.7970000"
"20102573","SMAN 60 JAKARTA","JL. KEMANG TIMUR I NO. 6","Prop. D.K.I. Jakarta","SMA","-6.2589000","106.8250000"
"20103174","SMAS PELITA TIGA NO 3 JAKARTA","JL. RAWAJAYA I","Prop. D.K.I. Jakarta","SMA","-6.2043000","106.8742000"
"69888992","SMA BUNDA MULIA  SCHOOL","Jl. Lodan Raya No.2","Prop. D.K.I. Jakarta","SMA","-6.1295000","106.8194000"
"20104437","SMAS PELITA KUDUS","JL. INDRALOKA RAYA NO. 33A","Prop. D.K.I. Jakarta","SMA","-6.1568000","106.7765000"
"20104414","SMAS DIAN KASIH","Perumahan Citra Garden 5 Blok H 1","Prop. D.K.I. Jakarta","SMA","-6.1312000","106.6969000"
"20100629","SMAS BUNGA HATI BANGSA","JL.VILA KAPUK INDAH  BLOK G / 1","Prop. D.K.I. Jakarta","SMA","-6.1325000","106.7613000"
"20100807","SMAN 15 JAKARTA","JL. AGUNG UTARA STS BLOK A","Prop. D.K.I. Jakarta","SMA","-6.1378000","106.8617000"
"20100601","SMAS KRISTEN 5 BPK PENABUR","JL. HIBRIDA RAYA BLOK QA3","Prop. D.K.I. Jakarta","SMA","-6.1482000","106.9082000"
"20103171","SMAS PGRI 24 JAKARTA","JL. SMPN 157","Prop. D.K.I. Jakarta","SMA","-6.2954000","106.9020000"
"20103288","SMAN 107 JAKARTA","JL. RAWA BADUNG TIMUR CAKUNG","Prop. D.K.I. Jakarta","SMA","-6.2059000","106.9253000"
"20107279","SMAS ISLAM AS SYAFIIYAH 01 JAKARTA","JL. BUKIT DURI SELATAN NO. 29","Prop. D.K.I. Jakarta","SMA","-6.2202000","106.8511000"
"20103403","SMAS BINA DHARMA JAKARTA","JL. RAYA CIRACAS NO. 39","Prop. D.K.I. Jakarta","SMA","-6.3275000","106.8847000"
"20104436","SMAS PELITA IV","JL. POS DURI RAYA NO. 23-29","Prop. D.K.I. Jakarta","SMA","-6.1559000","106.8019000"
"20100175","SMAS ADVENT SALEMBA","JL. SALEMBA RAYA NO. 47","Prop. D.K.I. Jakarta","SMA","-6.1969000","106.8515000"
"20103200","SMAS PUSAKA 1 JAKARTA","JL. TARUNA PAHLAWAN REVOLUSI","Prop. D.K.I. Jakarta","SMA","-6.2387000","106.8947000"
"69923322","SMA Raffles Christian School Kebon Jeruk","Jl. Pasanggrahan Raya","Prop. D.K.I. Jakarta","SMA","-6.1961550","106.7389850"
"20101339","SMAS BAPTIS CENGKARENG INDAH","KOMPLEK PERUM CENGKARENG INDAH BLOK GB/01","Prop. D.K.I. Jakarta","SMA","-6.1438000","106.7474000"
"20107276","SMAS AL AZHAR SYIFA BUDI","JL. KEMANG RAYA 7","Prop. D.K.I. Jakarta","SMA","-6.2542000","106.8112000"
"20101306","SMAS 1 KRISTEN BPK PENABUR","JL. TANJUNG DUREN RAYA NO. 4","Prop. D.K.I. Jakarta","SMA","-6.1743000","106.7813000"
"20102214","SMAN 34 JAKARTA","Jl. Margasatwa Raya No. 1","Prop. D.K.I. Jakarta","SMA","-6.3134000","106.7949000"
"20100779","SMAN 75 JAKARTA","JL. TIPAR CAKUNG","Prop. D.K.I. Jakarta","SMA","-6.1347000","106.9240000"
"20103307","SMAN 61 JAKARTA","JL.TARUNA PAHLAWAN REVOLUSI PONDOK BAMBU JAKARTA TIMUR","Prop. D.K.I. Jakarta","SMA","-6.2386000","106.8963000"
"20103213","SMAS BUDI MULIA UTAMA JAKARTA","RAWA JAYA NO. 5","Prop. D.K.I. Jakarta","SMA","-6.2350000","106.9438000"
"20102218","SMAN 26 JAKARTA","JL. TEBET BARAT IV","Prop. D.K.I. Jakarta","SMA","-6.2334000","106.8485000"
"20100800","SMAS YASPI JAKARTA","JL. DINAS KEBERSIHAN DKI","Prop. D.K.I. Jakarta","SMA","-6.1337000","106.9261000"
"69879021","SMA SAINT PETER SCHOOL","JL.BOULEVARD TIMUR RAYA NO. 8","Prop. D.K.I. Jakarta","SMA","-6.1700400","106.9086980"
"20100218","SMAN 20 JAKARTA","JL. KREKOT BUNDER III/I","Prop. D.K.I. Jakarta","SMA","-6.1593000","106.8324000"
"20103316","SMAS BINA PANGUDI LUHUR JAKARTA","JL. KRAMAT ASEM RAYA NO. 54","Prop. D.K.I. Jakarta","SMA","-6.2035000","106.8701000"
"20103167","SMAS PERGURUAN RAKYAT 3 JAKARTA","JL. PAHLAWAN REVOLUSI NO. 12","Prop. D.K.I. Jakarta","SMA","-6.2288000","106.8986000"
"20101326","SMAS MUHAMMADIYAH 13 JAKARTA","JL. GELONG BARU NO. 23A","Prop. D.K.I. Jakarta","SMA","-6.1766000","106.7972000"
"20177804","SMAK PENABUR KELAPA GADING","JL. BOULEVARD BUKIT GADING RAYA KAV. A5-A8","Prop. D.K.I. Jakarta","SMA","-6.1477000","106.9080000"
"20107340","SMAS YASPORBI 1 JAKARTA","JL. DEPOSITO I KOMP. BANK INDONESIA, MENTENG DALAM, TEBET, JAKARTA SELATAN","Prop. D.K.I. Jakarta","SMA","-6.2394000","106.8417000"
"20101322","SMAS PELITA 2","JL. MACAN NO.23-29 DAAN MOGOT","Prop. D.K.I. Jakarta","SMA","-6.1660000","106.7719000"
"20112282","SMAS CHARTAR BUANA","JL. PERUM CIBUBUR INDAH II","Prop. D.K.I. Jakarta","SMA","-6.3380000","106.8903000"
"20103308","SMAN 59 JAKARTA","BULAK TIMUR I/10-11","Prop. D.K.I. Jakarta","SMA","-6.2161000","106.9076000"
"20107380","SMAS JUBILEE","JL Sunter Jaya I No.1","Prop. D.K.I. Jakarta","SMA","-6.1440000","106.8722000"
"20100201","SMAN 77 JAKARTA","JL. CEMPAKA PUTIH TENGAH 17","Prop. D.K.I. Jakarta","SMA","-6.1753000","106.8662000"
"20103281","SMAN 31 JAKARTA","JL. KAYUMANIS TIMUR NO. 17","Prop. D.K.I. Jakarta","SMA","-6.2026000","106.8645000"
"20102216","SMAN 3 JAKARTA","SETIABUDI II","Prop. D.K.I. Jakarta","SMA","-6.2098000","106.8258000"
"20100187","SMAS KRISTEN 3 PENABUR JAKARTA","JL. GUNUNG SAHARI RAYA NO. 90 A","Prop. D.K.I. Jakarta","SMA","-6.1690000","106.8400000"
"20103203","SMAS DON BOSCO 2 JAKARTA","JL. PULO MAS BARAT V","Prop. D.K.I. Jakarta","SMA","-6.1748000","106.8813000"
"20103240","SMAS BPS&K I","Jl. Bina Karya No.2 Komplek Bina Marga I","Prop. D.K.I. Jakarta","SMA","-6.2334000","106.9388000"
"20112438","SMAS CITRA KASIH","CITRA GARDEN 5 BLOK H 3","Prop. D.K.I. Jakarta","SMA","-6.1358000","106.7020000"
"20103257","SMAN 98 JAKARTA","JL.JAHA   NO. 1","Prop. D.K.I. Jakarta","SMA","-6.3324000","106.8573000"
"20102193","SMAN 47 JAKARTA","Jalan Delman Utama I RT.001/011","Prop. D.K.I. Jakarta","SMA","-6.2471000","106.7731000"
"20103224","SMAS KRISTEN BERKAT JAKARTA","JL. JATINEGARA TIMUR NO. 89","Prop. D.K.I. Jakarta","SMA","-6.2220000","106.8683000"
"20102592","SMAN 49 JAKARTA","JL. PEPAYA NO. 9","Prop. D.K.I. Jakarta","SMA","-6.3237000","106.8192000"
"20107375","SMAS DHARMA SUCI JAKARTA","JL. JEMB 3 KOMP. PLUIT MAS BLOK F NO. 1-5","Prop. D.K.I. Jakarta","SMA","-6.1312000","106.7752000"
"69757184","SMAS KANAAN GLOBAL SCHOOL","PERUMAHAN TAMAN SURYA 3, JL  BOULEVARD BLOK L2","Prop. D.K.I. Jakarta","SMA","-6.1349000","106.7169000"
"20108505","SMAS KRISTEN PEMBANGUNAN 2","JL. PEMBANGUNAN 2 NO. 18","Prop. D.K.I. Jakarta","SMA","-6.1627000","106.8173000"
"20102576","SMAN RAGUNAN JAKARTA","JL. KOMPLEK GOR RAGUNAN","Prop. D.K.I. Jakarta","SMA","-6.3054000","106.8269000"
"20107388","SMAS NUSANTARA JAKARTA","JL. KRAMAT JAYA GG. VIII","Prop. D.K.I. Jakarta","SMA","-6.1189000","106.9204000"
"20100806","SMAN 13 JAKARTA","JL. SEROJA NO.1 TANJUNG PRIOK","Prop. D.K.I. Jakarta","SMA","-6.1191000","106.8946000"
"20100182","SMAS MUHAMMADIYAH 2 JAKARTA","JL. GARUDA NO. 33","Prop. D.K.I. Jakarta","SMA","-6.1624000","106.8423000"
"20100180","SMAS SUNDA KELAPA JAKARTA","JL. TAMAN SUNDA KELAPA 16 A Menteng Jakarta Pusat 10310","Prop. D.K.I. Jakarta","SMA","-6.2011000","106.8326000"
"20107310","SMAS KELUARGA WIDURI JAKARTA","JL. GUNUNG BALONG I / 2","Prop. D.K.I. Jakarta","SMA","-6.3037000","106.7880000"
"20103170","SMAS PGRI 10 JAKARTA","JL. RAWA KUNING GANG MUSHOLLA AL IKHSAN, RT 3 , RW 2, NO 119","Prop. D.K.I. Jakarta","SMA","-6.1981000","106.8658000"
"20107327","SMAS PSKD 4 JAKARTA","JL. PANGLIMA POLIM 2 NO. 51A","Prop. D.K.I. Jakarta","SMA","-6.2472000","106.8014000"
"20104405","SMAS AL KAMAL","JL. AL -  KAMAL KEDOYA RAYA  NO. 2","Prop. D.K.I. Jakarta","SMA","-6.1880000","106.7559000"
"20101302","SMAS 2 KRISTEN KETAPANG","JL. KOMP.  GREEN GARDEN BLOK M I","Prop. D.K.I. Jakarta","SMA","-6.1851000","106.7558000"
"20103285","SMAN 12 JAKARTA","JL. PERTANIAN KLENDER","Prop. D.K.I. Jakarta","SMA","-6.2147000","106.8978000"
"20100185","SMAS KARTINI 1 JAKARTA","JL. KALIBARU TIMUR V NO.1","Prop. D.K.I. Jakarta","SMA","-6.1658000","106.8554000"
"20107299","SMAS GONZAGA JAKARTA","JL. PEJATEN BARAT 10A","Prop. D.K.I. Jakarta","SMA","-6.2773000","106.8226000"
"20109513","SMAS HIGH SCOPE","JL. TB. SIMATUPANG NO. 8","Prop. D.K.I. Jakarta","SMA","-6.2930000","106.8043000"
"20104427","SMAS KRISTEN KALAM KUDUS","JL.TANGKILIO TIMUR NO.48-49","Prop. D.K.I. Jakarta","SMA","-6.1429000","106.8211000"
"20103287","SMAN 11 JAKARTA","JL. P KOMARUDIN 1 PANDIDIKAN PULO GEBANG CAKUNG JAKARTA TIMUR","Prop. D.K.I. Jakarta","SMA","-6.2057000","106.9403000"
"20109491","SMAS ISLAM AL-MARUF","JL. RAYA LAPANGAN TEMBAK - CIBUBUR","Prop. D.K.I. Jakarta","SMA","-6.3416000","106.8863000"
"20107302","SMAS IS AVICENA","JL. MOC. KAHFI  II  NO.66","Prop. D.K.I. Jakarta","SMA","-6.3467000","106.8154000"
"20107309","SMAS KARTIKA VIII-1 JAKARTA","JL. SEROJA","Prop. D.K.I. Jakarta","SMA","-6.3414000","106.8319000"
"20104421","SMAS KATOLIK ABDI SISWA","JL. PATRA TOMANG RAYA NO. 1","Prop. D.K.I. Jakarta","SMA","-6.1744000","106.7714000"
"20101616","SMAS SANTO CRISTOFORUS 1","JL. RAHAYU NO. 1A","Prop. D.K.I. Jakarta","SMA","-6.1645000","106.7848000"
"20100212","SMAN 35 JAKARTA","JL. MUTIARA","Prop. D.K.I. Jakarta","SMA","-6.2093000","106.8142000"
"20107193","SMAS KATOLIK NUSA MELATI","JL. HANKAM NO. 6 CIPAYUNG","Prop. D.K.I. Jakarta","SMA","-6.3303000","106.9041000"
"20100219","SMAN 24 JAKARTA","JL. LAPANGAN TEMBAK NO. 1  SENAYAN","Prop. D.K.I. Jakarta","SMA","-6.2109000","106.7964000"
"20107300","SMAS HANG TUAH 1 JAKARTA","JL. CILEDUK RAYA KOMP. SESKOAL","Prop. D.K.I. Jakarta","SMA","-6.2394000","106.7733000"
"20101583","SMAN 96 JAKARTA","JL. JATI RAYA NO. 40","Prop. D.K.I. Jakarta","SMA","-6.1470000","106.7396000"
"20107323","SMAS PATTIMURA JAKARTA","Jl. Jagakarsa Raya No. 88, RT. 02/05","Prop. D.K.I. Jakarta","SMA","-6.3266000","106.8192000"
"20103197","SMAS ST ANTONIUS JAKARTA","JL. DI PANJAITAN KAV. 46","Prop. D.K.I. Jakarta","SMA","-6.2215000","106.8739000"
"20100483","SMAS PSKD 3 JAKARTA","JL. KWINI I NO. 1","Prop. D.K.I. Jakarta","SMA","-6.1806000","106.8384000"
"20103198","SMAS SANTIKA","JL. BAMBU WULUNG NO. 2","Prop. D.K.I. Jakarta","SMA","-6.3316000","106.8934000"
"20107314","SMA MUHAMMADIYAH 3 JAKARTA","JL. LIMAU 3 BLOK B","Prop. D.K.I. Jakarta","SMA","-6.2480000","106.7907000"
"20107332","SMAS SUMBANGSIH JAKARTA","JL. AMPERA RAYA NO. 3-4","Prop. D.K.I. Jakarta","SMA","-6.2903000","106.8174000"
"20103303","SMAN 71 JAKARTA","JL. H. DOGOL","Prop. D.K.I. Jakarta","SMA","-6.2353000","106.9187000"
"20107589","SMAS GLOBAL ISLAMIC SCHOOL","JL. CONDET RAYA NO.5","Prop. D.K.I. Jakarta","SMA","-6.2824000","106.8551000"
"20100606","SMAS MUTIARA 1 JAKARTA","JL. KOMP. YOS SUDARSO II / 19","Prop. D.K.I. Jakarta","SMA","-6.1112000","106.8926000"
"69889089","SMA AUSTRALIAN INDEPENDENT SCHOOL INDONESIA JAKARTA","JL PEJATEN BARAT RAYA NO 69","Prop. D.K.I. Jakarta","SMA","-6.2985360","106.8285580"
"69917278","SMA MENTARI SCHOOL JAKARTA","Jl. H. Jian Rt. 004/03 No. 6","Prop. D.K.I. Jakarta","SMA","-6.2603160","106.8061060"
"20101350","SMAS HARAPAN JAYA","JL. DAAN MOGOT KM. 13","Prop. D.K.I. Jakarta","SMA","-6.1538000","106.7328000"
"20102215","SMAN 32 JAKARTA","JL. PANJANG KOMP.SETNEG BARU CIDODOL","Prop. D.K.I. Jakarta","SMA","-6.2322000","106.7744000"
"20103176","SMAS PANGUDI RAHAYU","JL. RAYA BOGOR KM 24,5","Prop. D.K.I. Jakarta","SMA","-6.3198000","106.8642000"
"20100801","SMAS YUSHA JAKARTA","JL. MAWAR LUAR NO. 1","Prop. D.K.I. Jakarta","SMA","-6.1194000","106.9085000"
"20107377","SMAS GITA KIRTI 2","JL. SUNTER JAYA IV NO. 2","Prop. D.K.I. Jakarta","SMA","-6.1558000","106.8674000"
"20100213","SMAS TRIWIBAWA JAKARTA","JL. RAJAWALI SELATAN I NO.30","Prop. D.K.I. Jakarta","SMA","-6.1464000","106.8378000"
"20107303","SMAS ISLAM HARAPAN IBU","Jl. H. Banan No. 1","Prop. D.K.I. Jakarta","SMA","-6.2729000","106.7740000"
"20107393","SMAS STELLA MARIS JAKARTA","JL. LELE BLOK A1","Prop. D.K.I. Jakarta","SMA","-6.1311000","106.7778000"
"69948873","SMA LENTERA KASIH","Jl. Sunter Permai Raya No.8","Prop. D.K.I. Jakarta","SMA","-6.1412250","106.8741050"
"20101626","SMAN 112 JAKARTA","JL. SANGGRAHAN","Prop. D.K.I. Jakarta","SMA","-6.1911000","106.7565000"
"20100610","SMAS PUSAKA ABADI JAKARTA","JL. V NO. 28 TELUK GONG","Prop. D.K.I. Jakarta","SMA","-6.1393000","106.7850000"
"69896714","SMA SINGAPORE SCHOOL, BONA VISTA","Jl. Bona Vista Raya, Lebak Bulus Jakarta Selatan 12440","Prop. D.K.I. Jakarta","SMA","-6.3006000","106.7847000"
"20107590","SMAS TRAMPIL 1 JAKARTA","JL. CILILITAN BESAR","Prop. D.K.I. Jakarta","SMA","-6.2630000","106.8738000"
"","SMA BEACON ACADEMY","Jl. Pegangsaan Dua No.66 Rt.004 Rw.19","Prop. D.K.I. Jakarta","SMA",".0000000",".0000000"
"20100796","SMAN 72 JAKARTA","JL. PRIHATIN KOMP  TNI AL","Prop. D.K.I. Jakarta","SMA","-6.1635000","106.8846000"
"20100616","SMAS DON BOSCO 1 JAKARTA","JL. BOULEVARD TIMUR KELAPA GADING","Prop. D.K.I. Jakarta","SMA","-6.1660000","106.9134000"
"20107284","SMA AL-KAUTSAR","JL. JEMBATAN SELATAN NO. 6 BLOK A","Prop. D.K.I. Jakarta","SMA","-6.2630000","106.8026000"
"20103297","SMAN 42 JAKARTA","JL. RAJAWALI HALIM PERDANA KUSUMA JAKARTA TIMUR","Prop. D.K.I. Jakarta","SMA","-6.2559000","106.8912000"
"20103206","SMAS DIAN PERSADA JAKARTA","JL. CIPINANG BARU I NO 21","Prop. D.K.I. Jakarta","SMA","-6.2009000","106.9546000"
"20107391","SMAS SANTO LUKAS 1 JAKARTA","JL ANCOL SELATAN II/ NO 1","Prop. D.K.I. Jakarta","SMA","-6.1306000","106.8583000"
"20100190","SMAS KRISTEN KARUNIA JAKARTA","JL. KARTINI RAYA NO. 10 A","Prop. D.K.I. Jakarta","SMA","-6.1583000","106.8362000"
"20103309","SMAN 58 JAKARTA","JL. RAYA CIRACAS NO. 2","Prop. D.K.I. Jakarta","SMA","-6.3282000","106.8775000"
"20103311","SMAN 53 JAKARTA","JL. CIPINANG JAYA II B","Prop. D.K.I. Jakarta","SMA","-6.2208000","106.8835000"
"20101613","SMAS 2 SANTO LEO","JL. KOSAMBI BARU SELATAN RAYA 1","Prop. D.K.I. Jakarta","SMA","-6.1738000","106.7154000"
"20102210","SMAN 46 JAKARTA","JL. MASJID DARUSSALAM","Prop. D.K.I. Jakarta","SMA","-6.2579000","106.7948000"
"20107295","SMAS DHARMA KARYA JAKARTA","JL. MELAWAI XII NO. 2 KAV. 207A","Prop. D.K.I. Jakarta","SMA","-6.2472000","106.7999000"
"20107367","SMAS AL JIHAD JAKARTA","JL. JIHAD PAPANGGO I","Prop. D.K.I. Jakarta","SMA","-6.1301000","106.8819000"
"20103305","SMAN 64 JAKARTA","JL. RAYA CIPAYUNG","Prop. D.K.I. Jakarta","SMA","-6.3310000","106.8906000"
"20101615","SMAS 2 SANTO KRISTOFORUS","PERUM TAMAN PALEM LESTARI BLOK A-18","Prop. D.K.I. Jakarta","SMA","-6.1349000","106.7246000"
"20101621","SMAN 23 JAKARTA","JL. MANDALA UTARA NO.6","Prop. D.K.I. Jakarta","SMA","-6.1718000","106.7994000"
"20107290","SMAS CITA BUANA","JL. PASO 84","Prop. D.K.I. Jakarta","SMA","-6.3158000","106.8148000"
"20100174","SMAS PERGURUAN NASIONAL JAKARTA","JL. CEMPAKA BARU TIMUR I NO. 1","Prop. D.K.I. Jakarta","SMA","-6.1696000","106.8623000"
"20103301","SMAN 81 JAKARTA","JL. KARTIKA EKAPAKSI KPAD JATIWARINGI KALIMALANG JAKARTA TIMUR","Prop. D.K.I. Jakarta","SMA","-6.2511000","106.9179000"
"20101313","SMAS KRISTEN SAMARIA KUDUS","JL RAYA MERUYA UTARA N0 17","Prop. D.K.I. Jakarta","SMA","-6.1969000","106.7544000"
"20107286","SMAS BUDI WALUYO JAKARTA","JL. CISANGGIRI 3/15","Prop. D.K.I. Jakarta","SMA","-6.2415000","106.8128000"
"20100221","SMAN 25 JAKARTA","JL. AM. SANGAJI NO. 22-24","Prop. D.K.I. Jakarta","SMA","-6.1674000","106.8139000"
"20100612","SMAS KRISTEN SAINT NICHOLAS","JL. PANTAI INDAH UTARA  BLOK S  NO. 8 PIK JAKARTA UTARA","Prop. D.K.I. Jakarta","SMA","-6.1399000","106.7758000"
"20101628","SMAS YP BDN","JL. DAAN MOGOT KOMP. BANK MANDIRI PESING","Prop. D.K.I. Jakarta","SMA","-6.1578000","106.7714000"
"20103180","SMAS MUHAMMADIYAH 23 JAKARTA","JL. DELIMA II BLOK C PERUMNAS","Prop. D.K.I. Jakarta","SMA","-6.2193000","106.9287000"
"20104432","SMAS KATOLIK SANG TIMUR","JL. KARMEL RAYA NO. 2","Prop. D.K.I. Jakarta","SMA","-6.1901000","106.7800000"
"20101630","SMAS 2 YADIKA","JL. KAMAL RAYA NO. 42","Prop. D.K.I. Jakarta","SMA","-6.1230000","106.7223000"
"20107313","SMA LABSCHOOL KEBAYORAN","JL. KH. AHMAD DAHLAN NO. 14","Prop. D.K.I. Jakarta","SMA","-6.2451000","106.7915000"
"69948835","SMA HIGHFIELD","Jl. Raya Rawa Domba No.88","Prop. D.K.I. Jakarta","SMA","-6.2246085","106.9172197"
"20100193","SMAS  PERGURUAN KSATRYA","JL. PERCETAKAN NEGARA","Prop. D.K.I. Jakarta","SMA","-6.1866000","106.8671000"
"20100214","SMAS YAPERMAS JAKARTA","JL. ANYER NO. 7 JAKARTA","Prop. D.K.I. Jakarta","SMA","-6.2026000","106.8439000"
"20102566","SMAN 82 JAKARTA","JL. DAHA II / 15A","Prop. D.K.I. Jakarta","SMA","-6.2312000","106.7996000"
"20103189","SMAS USWATUN HASANAH JAKARTA","JL. DEPNAKER NO. 2","Prop. D.K.I. Jakarta","SMA","-6.2852000","106.8822000"
"69955414","SMA EMIISc Jakarta","Jl. Raya Condet Kav. 7 No 27 Rt 001/003","Prop. D.K.I. Jakarta","SMA","-6.2770000","106.8558000"
"20107591","SMAS TRAMPIL 2 JAKARTA","JL. OLAHRAGA 2","Prop. D.K.I. Jakarta","SMA","-6.2677000","106.8613000"
