"schoolId","schoolName","schoolAddress","province","school_level","lat","long"
"20100184","SMAS MUHAMMADIYAH 14 JAKARTA","JL. DANAU LIMBOTO NO. 2","Prop. D.K.I. Jakarta","SMA","-6.2080000","106.8082000"
"20103424","SMAS ARENA SISWA 2","JL. KRAMAT ASEM RAYA NO. 46","Prop. D.K.I. Jakarta","SMA","-6.2035000","106.8707000"
"20101625","SMAN 16 JAKARTA","JL. BELIBIS TERUSAN NO. 16","Prop. D.K.I. Jakarta","SMA","-6.1933000","106.7862000"
"20103284","SMAN 14 JAKARTA","JL. SMA BARAT CILILITAN","Prop. D.K.I. Jakarta","SMA","-6.2563000","106.8678000"
"20101622","SMAN 2 JAKARTA","JL. GAJAH MADA NO. 175","Prop. D.K.I. Jakarta","SMA","-6.1485000","106.8161000"
"20100795","SMAN 73 JAKARTA","JL. RAYA CAKUNG CILINCING","Prop. D.K.I. Jakarta","SMA","-6.1115000","106.9244000"
"20103181","SMAS MUHAMMADIYAH 12 JAKARTA","JL. KHA DAHLAN NO. 20","Prop. D.K.I. Jakarta","SMA","-6.2088000","106.8630000"
"20107400","SMAS YAPPENDA","JL. SWASEMBADA TIMUR V NO. 10","Prop. D.K.I. Jakarta","SMA","-6.1252000","106.8905000"
"20103425","SMAS ANGKASA 2 H PERDANAKUSUMA","AVIA KOMPLEK SKADRON","Prop. D.K.I. Jakarta","SMA","-6.2755000","106.8883000"
"20107275","SMAS 28 OKTOBER 1928","JL. Mampang Prapatan XI","Prop. D.K.I. Jakarta","SMA","-6.2629000","106.8176000"
"20107398","SMAS WIJAYA KUSUMA JAKARTA","JL. BANDENGAN UTARA NO. 80","Prop. D.K.I. Jakarta","SMA","-6.1359000","106.8017000"
"20103204","SMAS DIPONEGORO 2 JAKARTA","JL. KAYU TINGGI CAKUNG","Prop. D.K.I. Jakarta","SMA","-6.1798000","106.9479000"
"20107382","SMAS KRISTEN IPEKA PLUIT","JL. PLUIT TIMUR B UTARA NO. 1","Prop. D.K.I. Jakarta","SMA","-6.1211000","106.7743000"
"20107342","SMAS YMIK 2 JAKARTA","MANGGARAI UTARA VII","Prop. D.K.I. Jakarta","SMA","-6.2112000","106.8522000"
"20104438","SMAS SUMPAH PEMUDA","JL.RAYA JOGLO NO.36","Prop. D.K.I. Jakarta","SMA","-6.2204000","106.7369000"
"20177916","SMAS LENTERA INDONESIA","JL. SULTAN ISKANDAR MUDA NO. 98","Prop. D.K.I. Jakarta","SMA","-6.2510000","106.7763000"
"20100603","SMAS KRISTEN YUSUF","JL. ARWANA 2/16 JEMBATAN DUA","Prop. D.K.I. Jakarta","SMA","-6.1414000","106.7948000"
"69856892","SMA NORTH JAKARTA INTERCULTURAL SCHOOL","JL. BOULEVARD BUKIT GADING RAYA","Prop. D.K.I. Jakarta","SMA","-6.1585530","106.8960250"
"20107374","SMA DARMA SATRIA PERSADA","JL. KOMPLEK TELUK INDAH BLOK Q2 NO. 2-4","Prop. D.K.I. Jakarta","SMA","-6.1392000","106.7740000"
"20100183","SMAS MUHAMMADIYAH 16 JAKARTA","JL. KALIBARU BARAT NO. 52D","Prop. D.K.I. Jakarta","SMA","-6.1699000","106.8465000"
"20103238","SMAS IGN SLAMET RIYADI","JL. RAYA BOGOR KM.24","Prop. D.K.I. Jakarta","SMA","-6.3169000","106.8624000"
"20107307","SMAS ISLAM AL-KHOLIDIN JAKARTA","Jalan Wijaya I Blok O Komp Masjid Syarif Hidayatullah","Prop. D.K.I. Jakarta","SMA","-6.2471000","106.8063000"
"20100811","SMAN 41 JAKARTA","JL. LAKS. RE MARTADINATA","Prop. D.K.I. Jakarta","SMA","-6.1304000","106.8525000"
"20101327","SMAS 3 KALAM KUDUS","JL.GREEN GARDEN B4 / 1","Prop. D.K.I. Jakarta","SMA","-6.1894000","106.7614000"
"20107399","SMAS YANIIC JAKARTA","JL. TELUK SEMANGKA NO. 103","Prop. D.K.I. Jakarta","SMA","-6.1411000","106.9278000"
"20103218","SMAS BUDAYA JAKARTA","JL. DERMAGA BARU KLENDER","Prop. D.K.I. Jakarta","SMA","-6.2189000","106.9067000"
"20107191","SMAS IT AL HALIMIYAH JAKARTA","JL. ROBUSTA RAYA NO. 31","Prop. D.K.I. Jakarta","SMA","-6.2250000","106.9467000"
"20100191","SMAS KRISTEN KETAPANG 1 JAKARTA","JL. K.H. ZAINUL ARIFIN 35","Prop. D.K.I. Jakarta","SMA","-6.1606000","106.8141000"
"20108383","SMAS SANTA URSULA","JL. POS NO. 2","Prop. D.K.I. Jakarta","SMA","-6.1687000","106.8340000"
"69889105","SMA MAHATMA GADING INTERCULTURAL SCHOOL","Jl. Boulevard BGR Komplek Villa Gading Indah Blok Q","Prop. D.K.I. Jakarta","SMA","-6.1468670","106.9076740"
"20107389","SMAS PERMATA INDAH JAKARTA","JL. KAMPUNG GUSTI BLOK A /1","Prop. D.K.I. Jakarta","SMA","-6.1390000","106.7781000"
"20100198","SMAS SANTA THERESIA JAKARTA","JL. HAJI AGUS SALIM 75 JAKARTA","Prop. D.K.I. Jakarta","SMA","-6.1891000","106.8255000"
"20110265","SMAS PELITA KASIH","JL. TAMAN PALEM LESTARI BLOK E.9 NO.1","Prop. D.K.I. Jakarta","SMA","-6.1408000","106.7227000"
"20107331","SMAS SULUH JAKARTA","JL. PALAPA RAYA NO. 1","Prop. D.K.I. Jakarta","SMA","-6.2883000","106.8422000"
"20107283","SMAS BINA NUSANTARA","JL. SULTAN ISKANDAR MUDA G. 8","Prop. D.K.I. Jakarta","SMA","-6.2595000","106.7821000"
"20100490","SMAS PSKD 1 JAKARTA","JL. DIPONEGORO NO. 80","Prop. D.K.I. Jakarta","SMA","-6.1803000","106.8401000"
"20104413","SMAS DIAN HARAPAN","JL. BEDUGUL DAAN MOGOT BARU NO. 1","Prop. D.K.I. Jakarta","SMA","-6.1478000","106.7075000"
"20107250","SMAS PSKD MANDIRI","JL. GGSY RATULANGI NO.14","Prop. D.K.I. Jakarta","SMA","-6.1886000","106.8319000"
"20101617","SMAS TUNAS INDONESIA","JL. DURI SEMANAN RT.01/01","Prop. D.K.I. Jakarta","SMA","-6.1625000","106.7135000"
"69816348","SMA KATOLIK LIA STEPHANIE","Taman Surya V Blok EE2 No. 20-27","Prop. D.K.I. Jakarta","SMA","-6.1425940","106.7095300"
"20103229","SMAS JAKARTA RAYA","JL. RAYA PONDOK GEDE  NO. 36","Prop. D.K.I. Jakarta","SMA","-6.2883000","106.8993000"
"20102231","SMAK TIRTAMARTA - BPK PENABUR","Jl. Sekolah Kencana IV, Pondok Indah","Prop. D.K.I. Jakarta","SMA","-6.2838000","106.7882000"
"20100611","SMAS PUSAKA NUSANTARA","JL. EDAM 2 NO. 17","Prop. D.K.I. Jakarta","SMA","-6.1110000","106.8919000"
"20100802","SMAN 110 JAKARTA","JL. BENDUNGAN MELAYU NO 80","Prop. D.K.I. Jakarta","SMA","-6.1337000","106.9050000"
"20101301","SMAS REGINA PACIS","JL. PALMERAH UTARA I","Prop. D.K.I. Jakarta","SMA","-6.2014000","106.7969000"
"20103228","SMAS KRISTEN 7 BPK PENABUR JAKARTA","JL. RAYA CIPINANG INDAH II","Prop. D.K.I. Jakarta","SMA","-6.2368000","106.8934000"
"20100186","SMAS KRISTEN 2 BPK PENABUR","JL. PINTU AIR RAYA NO. 11","Prop. D.K.I. Jakarta","SMA","-6.1667000","106.8313000"
"20100781","SMAN 83 JAKARTA","JL. TIPAR CAKUNG","Prop. D.K.I. Jakarta","SMA","-6.1561000","106.9274000"
"20112503","SMAS K CALVIN","JL. INDUSTRI B14 KAV. 1","Prop. D.K.I. Jakarta","SMA","-6.1528000","106.8429000"
"20107370","SMA BINA TUNAS BANGSA","JL. PLUIT TIMUR BLOK MM","Prop. D.K.I. Jakarta","SMA","-6.1420000","106.7949000"
"20104407","SMAS BUKIT SION","TAMAN KEBON JERUK BLOK GA 1","Prop. D.K.I. Jakarta","SMA","-6.2001000","106.7445000"
"20109180","SMAS MARIE JOSEPH","JL PUSPA GADING I BLOK H2 No.10-12 Pegangsaan Dua Kelapa Gading Jakarta Utara","Prop. D.K.I. Jakarta","SMA","-6.1731000","106.9148000"
"20103212","SMAS CAHAYA SAKTI JAKARTA","JL. OTISTA NO. I/II","Prop. D.K.I. Jakarta","SMA","-6.2253000","106.8682000"
"20100199","SMAN 68 JAKARTA","JL. SALEMBA RAYA 18","Prop. D.K.I. Jakarta","SMA","-6.1979000","106.8509000"
"20103278","SMAN 91 JAKARTA","JL.LEMBAH LONTAR","Prop. D.K.I. Jakarta","SMA","-6.2389000","106.9328000"
"20107318","SMAS MUTTAQIEN JAKARTA","JL. ASEM BARIS RAYA NO. 5","Prop. D.K.I. Jakarta","SMA","-6.2334000","106.8620000"
"69755458","SMA PELANGI KASIH","TAMAN GRISENDA A1/28 JL. PANTAI INDAH TIMUR","Prop. D.K.I. Jakarta","SMA","-6.0995000","106.7197000"
"20100804","SMAN 114 JAKARTA","JL. PEDONGKELAN NO 25","Prop. D.K.I. Jakarta","SMA","-6.1095000","106.9349000"
"20101342","SMAS DAMAI","JL. DURI SELATAN V NO. 29","Prop. D.K.I. Jakarta","SMA","-6.1593000","106.8045000"
"20101329","SMAS CENGKARENG 1","JL. BAMBU LARANGAN RAYA NO. 67","Prop. D.K.I. Jakarta","SMA","-6.1426000","106.7182000"
"20108506","SMAS PGRI 15 JAKARTA","JL. MUTIARA","Prop. D.K.I. Jakarta","SMA","-6.2089000","106.8148000"
"20103214","SMAS BUDHI WARMAN 2","JL. RAYA BOGOR KM.28","Prop. D.K.I. Jakarta","SMA","-6.3407000","106.8650000"
"20107394","SMAS ST MARIA DELLA STRADA","JL. PADEMANGAN I GG. 7/18","Prop. D.K.I. Jakarta","SMA","-6.1321000","106.8342000"
"20102563","SMAN 90 JAKARTA","Jl. Sabar Petukangan`","Prop. D.K.I. Jakarta","SMA","-6.2435000","106.7481000"
"20103220","SMAS FRANSISKUS 2 JAKARTA","JL. BANGUNAN BARAT 29","Prop. D.K.I. Jakarta","SMA","-6.1849000","106.8808000"
"20107294","SMAS DEWI SARTIKA","JL. TEBET BARAT DALAM NO. 39","Prop. D.K.I. Jakarta","SMA","-6.2373000","106.8477000"
"20101332","SMAS BUNDA HATI KUDUS","JL. RAHAYU NO. 22","Prop. D.K.I. Jakarta","SMA","-6.1642000","106.7857000"
"20100210","SMAN 5 JAKARTA","JL. RAYA SUMUR BATU","Prop. D.K.I. Jakarta","SMA","-6.1594000","106.8669000"
"20101318","SMAS PROVIDENTIA","JL. KEDOYA RAYA NO. 35","Prop. D.K.I. Jakarta","SMA","-6.1662000","106.7636000"
"20107278","SMAS ASISI JAKARTA","JL. HAJI RAMLI RT. 005/03","Prop. D.K.I. Jakarta","SMA","-6.2314000","106.8423000"
"20100181","SMAS TAMAN MADYA I JAKARTA","JL. SUNTER BENDUNGAN JAGO 11","Prop. D.K.I. Jakarta","SMA","-6.1573000","106.8571000"
"20103194","SMAS ST ALEXIUS JAKARTA","JL. AMAL NO. 2 RT. 06/01","Prop. D.K.I. Jakarta","SMA","-6.2268000","106.8994000"
"69939320","SMA Raffles Christian School Kelapa Gading","Jalan Gading Pelangi 1, Kelurahan Pegangsaan Dua, Kecamatan Kelapa Gading, Kota","Prop. D.K.I. Jakarta","SMA","-6.1707000","106.9025000"
"20109467","SMAS KRISTEN IPEKA PURI INDAH","JL. PURI INDAH BLOK I","Prop. D.K.I. Jakarta","SMA","-6.1878000","106.7500000"
"20100173","SMAS PASKALIS","JL. RANJAU NO. 13 KODAM","Prop. D.K.I. Jakarta","SMA","-6.1616000","106.8727000"
"20104424","SMAS KRISTEN IPEKA TOMANG","GREEN VILLE BLOK D","Prop. D.K.I. Jakarta","SMA","-6.1695000","106.7790000"
"20109516","SMAS INTERNATIONAL ISLAMIC HIGH SCHOOL (IIHS)","JL. HR. RASUNA SAID KAV. X-2 NO. 4","Prop. D.K.I. Jakarta","SMA","-6.2279000","106.8336000"
"20102213","SMAN 37 JAKARTA","JL. H. KEBON BARU","Prop. D.K.I. Jakarta","SMA","-6.2346000","106.8587000"
"20103430","SMAS PSKD II JAKARTA","JL. TAMAN SLAMET RIYADI NO. 03","Prop. D.K.I. Jakarta","SMA","-6.2115000","106.8589000"
"20103187","SMAS VILLA MAS JAKARTA","JL. KAYU PUTIH UTARA 3C","Prop. D.K.I. Jakarta","SMA","-6.1813000","106.8975000"
"20101624","SMAN 17 JAKARTA","JL. Mangga Besar IV/I No.27","Prop. D.K.I. Jakarta","SMA","-6.1525000","106.8240000"
"20101353","SMAS FATAHILLAH","JL. DR. SEMERU RAYA NO. 1","Prop. D.K.I. Jakarta","SMA","-6.1585000","106.7962000"
"20103428","SMAS AL GHURABAA JAKARTA","JL. TENGGIRI RAYA NO. 47","Prop. D.K.I. Jakarta","SMA","-6.1992000","106.8921000"
"20101330","SMAS CANDRA NAYA","JL. JEMBATAN BESI II NO. 26","Prop. D.K.I. Jakarta","SMA","-6.1501000","106.7962000"
"20102565","SMAN 86 JAKARTA","Jl. Bintaro Permai IV No. 36","Prop. D.K.I. Jakarta","SMA","-6.2622000","106.7613000"
"20101606","SMAS TUNAS HARAPAN","JL. KOMPLEK BANK BNI PESING","Prop. D.K.I. Jakarta","SMA","-6.1554000","106.7719000"
"20103231","SMAS MALAHAYATI","JL. BIMA NO.3","Prop. D.K.I. Jakarta","SMA","-6.3249000","106.8594000"
"20101331","SMAS CAKRA BUANA","JL. KOMPLEK KEBERSIHAN 17","Prop. D.K.I. Jakarta","SMA","-6.1277000","106.7196000"
"20109933","SMAN UNGGULAN M.H. THAMRIN","JL BAMBU WULUNG","Prop. D.K.I. Jakarta","SMA","-6.3159000","106.9019000"
"20103216","SMAS BUDHAYA 2 ST AGUSTINUS","Jl. Radin Inten II, Buaran","Prop. D.K.I. Jakarta","SMA","-6.2207000","106.9230000"
"20103219","SMAS FONS VITAE 1 JAKARTA","JL. MATRAMAN RAYA NO. 129","Prop. D.K.I. Jakarta","SMA","-6.2074000","106.8594000"
"20100632","SMAS TUNAS GADING","JL. GADING PUTIH RAYA P2/23","Prop. D.K.I. Jakarta","SMA","-6.1680000","106.9121000"
"20107287","SMA BUNDA KANDUNG JAKARTA","JL.POL. TANGAN RAYA NO.41","Prop. D.K.I. Jakarta","SMA","-6.2955000","106.8429000"
"20103173","SMAS PEMBANGUNAN 3 JATINEGARA","RAYA BEKASI KM. 18","Prop. D.K.I. Jakarta","SMA","-6.1882000","106.9648000"
"20107288","SMA CENDERAWASIH 1","JL. RS. FATMAWATI KOMPLEK KEMLU","Prop. D.K.I. Jakarta","SMA","-6.3127000","106.7943000"
"20103183","SMAS PKP","JL. KELAPA DUA WETAN","Prop. D.K.I. Jakarta","SMA","-6.3390000","106.8834000"
"20108504","SMAS NASIONAL ANGLO","JL. RAJAWALI SELATAN NO. 10 X","Prop. D.K.I. Jakarta","SMA","-6.1927000","106.8673000"
"20107289","SMA CHARITAS","JL. MAWAR INDAH 75","Prop. D.K.I. Jakarta","SMA","-6.2967000","106.7716000"
"20107384","SMAS KRISTEN TUNAS BANGSA","JL SUNTER GARDEN BLOK. C-7","Prop. D.K.I. Jakarta","SMA","-6.1392000","106.8749000"
"20100607","SMAS PERMAI JAKARTA","JL. PLUIT KARANG BARAT BLOK O - VI","Prop. D.K.I. Jakarta","SMA","-6.1211000","106.7742000"
"","SMA HERITAGE SCHOOL JAKARTA","Jl. Letjen Soepono No 34","Prop. D.K.I. Jakarta","SMA","-6.2713475","106.7819156"
"20107319","SMAN 28 JAKARTA","Jl. Raya Ragunan","Prop. D.K.I. Jakarta","SMA","-6.2858000","106.8332000"
"20100200","SMAN 7 JAKARTA","JL. KARET PS. BARU BARAT V","Prop. D.K.I. Jakarta","SMA","-6.2109000","106.8147000"
"20107280","SMAS BAKTI IDHATA JAKARTA","JL. MELATI NO. 25","Prop. D.K.I. Jakarta","SMA","-6.2836000","106.7942000"
"20100505","SMAS ISLAM AL - JIHAD JAKARTA","JL. KRAMAT JAYA BARU","Prop. D.K.I. Jakarta","SMA","-6.1857000","106.8517000"
"20102562","SMAN 97 JAKARTA","JL. BRIGIF 2 CIGANJUR","Prop. D.K.I. Jakarta","SMA","-6.3422000","106.8010000"
"20103185","SMAS WIJAYA KUSUMA","JL. MUJAHIDIN NO. 17A RAMBUTAN. JAKTIM","Prop. D.K.I. Jakarta","SMA","-6.3084000","106.8803000"
"20104417","SMAS JOSUA","Jl. Kota Bambu Utara II No. 08","Prop. D.K.I. Jakarta","SMA","-6.1855000","106.8073000"
"20107326","SMAS PGRI 3 JAKARTA","JL. PONDOK LABU IB NO. 29A","Prop. D.K.I. Jakarta","SMA","-6.3046000","106.7920000"
"20101623","SMAN 19 JAKARTA","JL. PERNIAGAAN NO. 31","Prop. D.K.I. Jakarta","SMA","-6.1445000","106.8221000"
"20104430","SMAS PETRA","JL. TAMAN ALFA INDAH BLOK A- 11","Prop. D.K.I. Jakarta","SMA","-6.2197000","106.7503000"
"20100630","SMAS DHARMA BUDHI BHAKTI JAKARTA","JL. AGUNG TENGAH VII NO. 1","Prop. D.K.I. Jakarta","SMA","-6.1445000","106.8684000"
"69873573","SMA WESTIN","TELUK GONG JL. G NO 408","Prop. D.K.I. Jakarta","SMA","-6.1360750","106.7818620"
"20103298","SMAN 44 JAKARTA","JL. DELIMA IV PERUMNAS KLENDER","Prop. D.K.I. Jakarta","SMA","-6.2222000","106.9292000"
"20100608","SMAS PGRI 12 JAKARTA","JL. TABAH I NO. 5","Prop. D.K.I. Jakarta","SMA","-6.1633000","106.8852000"
"20103205","SMAS DIPONEGORO 1 JAKARTA","JL. SUNAN GIRI NO. 5","Prop. D.K.I. Jakarta","SMA","-6.1955000","106.8832000"
"20102211","SMAN 43 JAKARTA","JL. MINANGKABAU DALAM","Prop. D.K.I. Jakarta","SMA","-6.2171000","106.8410000"
"20103215","SMAS BUDHI WARMAN 1","JL. RAYA BOGOR KM. 19","Prop. D.K.I. Jakarta","SMA","-6.2854000","106.8728000"
"20101337","SMAS BHINEKA TUNGGAL IKA","JL. K.H. M. MANSYUR NO. 222 A","Prop. D.K.I. Jakarta","SMA","-6.1473000","106.8066000"
"20104423","SMAK IPEKA INTEGRATED CHRISTIAN SCHOOL","KOMPLEK TAMAN MERUYA ILIR  JL. BATU MULIA BLOK K JAKARTA BARAT","Prop. D.K.I. Jakarta","SMA","-6.1994000","106.7379000"
"20101325","SMAS MUHAMMADIYAH 24","JL. DR. SUSILO 1 GROGOL","Prop. D.K.I. Jakarta","SMA","-6.1633000","106.7936000"
"20102571","SMAN 66 JAKARTA","JL. BANGO III PONDOK LABU CILANDAK JAKARTA SELATAN","Prop. D.K.I. Jakarta","SMA","-6.3066000","106.8050000"
"20103295","SMAS YP IPPI JAKARTA","JL. RAYA PANGGILINGAN A.ELOK","Prop. D.K.I. Jakarta","SMA","-6.1996000","106.9402000"
"20107311","SMA KEMALA BHAYANGKARI 1","Jl. Ampera Raya Komplek Polri Ragunan","Prop. D.K.I. Jakarta","SMA","-6.2831000","106.8195000"
"20101305","SMAS 4 KRISTEN PENABUR","JL. SURYA SRANA SUNRISE","Prop. D.K.I. Jakarta","SMA","-6.1749000","106.7626000"
"20103210","SMAS CORPATARIN JAKARTA","JL. PONDOK KOPI RAYA NO. 87","Prop. D.K.I. Jakarta","SMA","-6.2273000","106.9439000"
"20107298","SMAS GITTA KIRTTI 3 JAKARTA","JL. BRI RADIO DALAM","Prop. D.K.I. Jakarta","SMA","-6.2588000","106.7918000"
"20100177","SMAS PGRI 14 DKI JAKARTA","JL. SETIA KAWAN 3 NO. 25","Prop. D.K.I. Jakarta","SMA","-6.1645000","106.8014000"
"20100778","SMAS TUNAS KARYA JAKARTA","JL. PALEPAH KUNING NO. 3","Prop. D.K.I. Jakarta","SMA","-6.1609000","106.9036000"
"20103258","SMAN 93 JAKARTA","JL. RAYA BOGOR KOMP. PASWALPRES","Prop. D.K.I. Jakarta","SMA","-6.2918000","106.8692000"
"20109326","SMAS KASIH KARUNIA","Taman Palem Lestari Blok F6 No. 21-23","Prop. D.K.I. Jakarta","SMA","-6.1394000","106.7194000"
"20107274","SMAS 17 AGUSTUS 45 JAKARTA","JL. TEBET DALAM 3A","Prop. D.K.I. Jakarta","SMA","-6.2247000","106.8502000"
"20104410","SMAS  GLOBAL SEVILLA PURI INDAH","JL.KEMBANGAN RAYA BLOK JJ NO.1","Prop. D.K.I. Jakarta","SMA","-6.1773000","106.7462000"
"20103294","SMAN 100 JAKARTA","JL. PERSATUAN 2","Prop. D.K.I. Jakarta","SMA","-6.2294000","106.8826000"
"20103227","SMA KAPIN","JL. RAYA KALIMALANG","Prop. D.K.I. Jakarta","SMA","-6.2504000","106.9291000"
"20102564","SMAN 87 JAKARTA","JL Mawar II","Prop. D.K.I. Jakarta","SMA","-6.2864000","106.7612000"
"20101338","SMAS BAPTIS ELIM","JL DR. SUSILO 1 / 388","Prop. D.K.I. Jakarta","SMA","-6.1659000","106.7917000"
"20100600","SMA ISLAM AL-AZHAR KELAPA GADING","Jl. Bulevar Timur","Prop. D.K.I. Jakarta","SMA","-6.1635000","106.9097000"
"20101307","SMAS 2 KEMURNIAN","PERUM GREEN VILLE BLOK Q/209","Prop. D.K.I. Jakarta","SMA","-6.1689000","106.7795000"
"20100803","SMAN 111 JAKARTA","JL. BANDENGAN UTARA 80","Prop. D.K.I. Jakarta","SMA","-6.1359000","106.8017000"
"69772648","SMAS LAKESIDE MONTESSORI","VILLA CIBUBUR INDAH U1-16 CIBUBUR","Prop. D.K.I. Jakarta","SMA","-6.3510000","106.8768000"
"20107277","SMAS AL IZHAR JAKARTA","JL. RS. FATMAWATI KAV. 49","Prop. D.K.I. Jakarta","SMA","-6.3103000","106.7935000"
"69759048","SMAS BINA KUSUMA MULIA","CITRA GARDEN I BLOK I-8","Prop. D.K.I. Jakarta","SMA","-6.1011000","106.6936000"
"20101340","SMAS AL HUDA CENGKARENG","JL. UTAMA RAYA NO. 2","Prop. D.K.I. Jakarta","SMA","-6.1497000","106.7273000"
"20100484","SMAS AT TAQWA JAKARTA","JL. RAJAWALI SELATAN VI NO. 18","Prop. D.K.I. Jakarta","SMA","-6.1454000","106.8396000"
"20101351","SMAS 2 GALATIA","JL. MERPATI RAYA NO. 1","Prop. D.K.I. Jakarta","SMA","-6.1559000","106.7760000"
"20103427","SMAS AL HIKMAH JAKARTA","JL. JATI BARANG V NO. 40","Prop. D.K.I. Jakarta","SMA","-6.1917000","106.9007000"
"20103291","SMAN 104 JAKARTA","JL. H. TAIMAN BARAT KEL.GEDONG,JAKARTA TIMUR","Prop. D.K.I. Jakarta","SMA","-6.2991000","106.8622000"
"20107387","SMAS NURUL FALAH JAKARTA","DEWA KEMBARN KOMP.TNI AL","Prop. D.K.I. Jakarta","SMA","-6.1083000","106.9259000"
"20107320","SMAN 79 JAKARTA","JL. MENTENG PULO UJUNG","Prop. D.K.I. Jakarta","SMA","-6.2222000","106.8381000"
"20103289","SMAN 106 JAKARTA","JL. GANDARIA I PEKAYON PASAR REBO JAKARTA TIMUR","Prop. D.K.I. Jakarta","SMA","-6.3148000","106.8748000"
"20107390","SMAS SAINT PETER","JL. BOULEVARD TIMUR RAYA NO. 8","Prop. D.K.I. Jakarta","SMA","-6.1652000","106.9148000"
"20103196","SMAS SANTO YOSEPH JAKARTA","PERUM. METLAND MENTENG KAV F-4","Prop. D.K.I. Jakarta","SMA","-6.1815000","106.9697000"
"20103241","SMAS YAKE JAKARTA","JL. RAYA JATINEGARA  TIMUR","Prop. D.K.I. Jakarta","SMA","-6.2220000","106.8683000"
"20101614","SMAS SANTO LEO","JL. MANGGA BESAR RAYA NO. 43","Prop. D.K.I. Jakarta","SMA","-6.1497000","106.8202000"
"20100215","SMAS YP IPPI PETOJO JAKARTA","JL. PETOJO BARAT III/2","Prop. D.K.I. Jakarta","SMA","-6.1638000","106.8113000"
"20104411","SMAS DUTA BANGSA","JL. KAPUK RAYA RT 02/011-71","Prop. D.K.I. Jakarta","SMA","-6.1364000","106.7448000"
"20101467","SMAS SAN MARINO","JL. CITRA GARDEN I BLOK  I NO. 1","Prop. D.K.I. Jakarta","SMA","-6.1503940","106.6937310"
"20107328","SMAS PURNAMA JAKARTA","JL. TIRTAYASA V","Prop. D.K.I. Jakarta","SMA","-6.2415000","106.8058000"
"20103190","SMAS TUNAS MARKATIN JAKARTA","JL. WARU NO. 20 B","Prop. D.K.I. Jakarta","SMA","-6.1959000","106.8883000"
"20100211","SMAN 4 JAKARTA","JL. BATU NO. 3 GAMBIR","Prop. D.K.I. Jakarta","SMA","-6.1788000","106.8356000"
"20101314","SMA LAMAHOLOT","JL. JAGUNG RAYA BOJONG INDAH","Prop. D.K.I. Jakarta","SMA","-6.1634000","106.7369000"
"20103312","SMAN 51 JAKARTA","JL. BATU AMPAR 3 CONDET","Prop. D.K.I. Jakarta","SMA","-6.2767000","106.8614000"
"20107232","SMA ACS JAKARTA","JL. BANTAR JATI SETU","Prop. D.K.I. Jakarta","SMA","-6.3115000","106.9209000"
"20101334","SMAS BUDI MURNI 2","JL. PURI KEMBANGAN NO. 2","Prop. D.K.I. Jakarta","SMA","-6.1842000","106.7561000"
"20101619","SMAS 1 YADIKA","JL. TANJUNG DUREN BARAT IV/8","Prop. D.K.I. Jakarta","SMA","-6.1780000","106.7817000"
"20101588","SMAN 78 JAKARTA","JL. BHAKTI IV/1 KOMP. PAJAK","Prop. D.K.I. Jakarta","SMA","-6.1914000","106.7828000"
"69874086","SMA PELITA HARAPAN INTERNASIONAL","JL. PANGERAN ANTASARI NO. 36","Prop. D.K.I. Jakarta","SMA","-6.2499110","106.8315450"
"20100599","SMAS GANDHI ANCOL","JL. PANGANDARAN IX BLOK B4 No. 1","Prop. D.K.I. Jakarta","SMA","-6.1272000","106.8368000"
"20100188","SMAS KRISTEN BETHEL JAKARTA","JL. PETAMBURAN IV NO.4","Prop. D.K.I. Jakarta","SMA","-6.1964000","106.8058000"
"20103182","SMAS PGRI 4 JAKARTA","JL. RAYA CIPAYUNG","Prop. D.K.I. Jakarta","SMA","-6.3324000","106.8921000"
"20107334","SMA TARAKANITA 1 JAKARTA","JL. PULO RAYA IV NO 17","Prop. D.K.I. Jakarta","SMA","-6.2461000","106.8121000"
"20103195","SMAS SAPTA KHARISMA JAKARTA","JL. RAYA PULO GEBANG NO. 99","Prop. D.K.I. Jakarta","SMA","-6.1942000","106.9561000"
"","Jakarta Taipei School","Jl. Raya Kelapa Hybrida Blok QH Kelapa Gading Permai","Prop. D.K.I. Jakarta","SMA","-6.1709910","106.9089096"
"20103191","SMAS TRISOKO JAKARTA","JL. RAYA PONDOK GEDE DUKUH II/IV","Prop. D.K.I. Jakarta","SMA","-6.2684000","106.8607000"
"20101627","SMAN 101 JAKARTA","JL. KOMPLEK JOGLO BARU","Prop. D.K.I. Jakarta","SMA","-6.2175000","106.7205000"
"20107315","SMAS MUHAMMADIYAH 18 JAKARTA","JL. PANJANG CIPULIR RT. 008/009","Prop. D.K.I. Jakarta","SMA","-6.2345000","106.7717000"
"20103310","SMAN 54 JAKARTA","KOMPLEK PENDIDIKAN RAWA BUNGA JLNJATI NEGARA TIMUR IV JAKARTA TIMUR","Prop. D.K.I. Jakarta","SMA","-6.2214000","106.8705000"
"20103279","SMAN 9 JAKARTA","JL. SMU 9  HALIM PERDANA KUSUMA,JAKARTA TIMUR","Prop. D.K.I. Jakarta","SMA","-6.2587000","106.8815000"
"20103429","SMAS ADI LUHUR JAKARTA","JL. RAYA CONDET  NO. 4","Prop. D.K.I. Jakarta","SMA","-6.2930000","106.8557000"
"20107385","SMAS LAPHAT PLUS","JL. BAYANGKARA NO. 47","Prop. D.K.I. Jakarta","SMA","-6.1319000","106.9132000"
"20112406","SMAS PLUS KHADIJAH","JL. BATAN I NO.12 PASAR JUMAT RT 005 RW 02","Prop. D.K.I. Jakarta","SMA","-6.3103000","106.7990000"
"20102212","SMAN 38 JAKARTA","JL. RAYA LENTENG AGUNG","Prop. D.K.I. Jakarta","SMA","-6.3360000","106.8360000"
"20107269","SMAS AL CHASANAH","JL. TANJUNG DUREN BARAT 3/1","Prop. D.K.I. Jakarta","SMA","-6.1742000","106.7799000"
"20103293","SMAN 102 JAKARTA","JL. KAYU TINGGI,CAKUNG JAKARTA TIMUR","Prop. D.K.I. Jakarta","SMA","-6.1671000","106.9506000"
"20103426","SMAS ANGKASA 1 H PERDANAKUSUMA","JL. TRIKORA RAYA","Prop. D.K.I. Jakarta","SMA","-6.2502000","106.8823000"
"69883506","SMA GARUDA CENDEKIA","JL. BANGKA VII DALAM NO 14","Prop. D.K.I. Jakarta","SMA","-6.2566500","106.8182190"
"20104434","SMAS NASIONAL NUSANTARA","JL. CENDRAWASIH 2 NO. 1","Prop. D.K.I. Jakarta","SMA","-6.1450000","106.7282000"
"20101608","SMAS TRI RATNA","JL. TALIB I NO. 35-37","Prop. D.K.I. Jakarta","SMA","-6.1585000","106.8152000"
"20100812","SMAN 45 JAKARTA","JL. PERINTIS KEMERDEKAAN","Prop. D.K.I. Jakarta","SMA","-6.1746000","106.9056000"
"20107297","SMAS FATAHILLAH JAKARTA","JL. RAYA BUNCIT NO.67","Prop. D.K.I. Jakarta","SMA","-6.2741000","106.8319000"
"20101631","SMAS SANTO ANDREAS","KOMP GREEN GARDEN J 5 N0 1","Prop. D.K.I. Jakarta","SMA","-6.1889000","106.7583000"
"20101348","SMAS ISLAM TAMBORA","JL. TAMBORA MESJID NO. 11","Prop. D.K.I. Jakarta","SMA","-6.1453000","106.8100000"
"20107325","SMAS PERG CIKINI JAKARTA","JL. DUREN TIGA RAYA","Prop. D.K.I. Jakarta","SMA","-6.2527000","106.8333000"
"20103192","SMA TELADAN 1 JAKARTA","JL. MADRASAH  NO.49","Prop. D.K.I. Jakarta","SMA","-6.3182000","106.8966000"
"69935208","SMA ISLAM AL JABR","JL. BANGO II NO. 30 - 38 RT 006/03","Prop. D.K.I. Jakarta","SMA","-6.3072880","106.7930350"
"69948476","SMA PERGURUAN ADVENT XV ","Jl. Pembaharuan Kelapa Dua Wetan","Prop. D.K.I. Jakarta","SMA","-6.3471551","106.8813849"
"20102574","SMAN 6 JAKARTA","Jl. Mahakam I Blok C No. 2","Prop. D.K.I. Jakarta","SMA","-6.2429000","106.7975000"
"20104419","SMAS KRISTEN TIARA KASIH","JL.DARMA RAYA BLOK C1 TSI","Prop. D.K.I. Jakarta","SMA","-6.1642000","106.7248000"
"20104416","SMAS IMPIAN BUNDA","JL. FLAMBOYAN UTAMA III B C7 NO.1 A","Prop. D.K.I. Jakarta","SMA","-6.1558000","106.7176000"
"20101587","SMAN 84 JAKARTA","JL. PETA BARAT NO. 42","Prop. D.K.I. Jakarta","SMA","-6.1449000","106.7044000"
"20101605","SMAN 56 JAKARTA","JL. RAYA KAMAL","Prop. D.K.I. Jakarta","SMA","-6.1199000","106.7200000"
"69774557","SMAS SPRINGFIELD","JL. PULAU SELAYAR BLOK B 1 NO 1","Prop. D.K.I. Jakarta","SMA","-6.1754000","106.7384000"
"20100224","SMAN 30 JAKARTA","JL. JEND. A. YANI","Prop. D.K.I. Jakarta","SMA","-6.1869000","106.8749000"
"20107322","SMAS PANGUDI LUHUR JAKARTA","JL. BRAWIJAYA IV NO. 47","Prop. D.K.I. Jakarta","SMA","-6.2536000","106.8064000"
"20107292","SMAS DARUNNAJAH","JL.ULUJAMI RAYA NO. 86","Prop. D.K.I. Jakarta","SMA","-6.2474000","106.7623000"
"69754377","SMAS NARADA","Perumahan Kosambi Baru Blok A Ext. 1","Prop. D.K.I. Jakarta","SMA","-6.1719580","106.7157410"
"20102217","SMAN 29 JAKARTA","Jl. Kramat No.6","Prop. D.K.I. Jakarta","SMA","-6.2372000","106.7840000"
"20103290","SMAN 105 JAKARTA","Jln. Usman Kelapa Dua Wetan","Prop. D.K.I. Jakarta","SMA","-6.3316000","106.8837000"
"20102230","SMAN 108 JAKARTA","Jl. Kesadaran, Ulujami Raya","Prop. D.K.I. Jakarta","SMA","-6.2527000","106.7619000"
"20107306","SMAS ISLAM AL-AZHAR 3 JAKARTA","JL. SISINGAMANGARAJA","Prop. D.K.I. Jakarta","SMA","-6.2339000","106.8001000"
"20100223","SMAN 27 JAKARTA","JL. MARDANI RAYA JAKARTA","Prop. D.K.I. Jakarta","SMA","-6.1820000","106.8612000"
"20103179","SMAS MUHAMMADIYAH 4 JAKARTA","JL. DEWI SARTIKA 316 A","Prop. D.K.I. Jakarta","SMA","-6.2494000","106.8662000"
"20107305","SMA ISLAM AL-AZHAR 2 JAKARTA","JALAN SIAGA RAYA","Prop. D.K.I. Jakarta","SMA","-6.2973000","106.8350000"
"20109971","SMAS CINTA KASIH TZU CHI","JL.KAMAL RAYA OUTER RING ROAD NO.20","Prop. D.K.I. Jakarta","SMA","-6.1317000","106.7379000"
